relative_path,action,old_head,new_head
amara_full_body_0002.txt,changed,Amara's left-back body (excluding her lower legs): She is turning back to look a,236135Amara's left-back body (excluding her lower legs): She is turning back to 
amara_full_body_0003.txt,changed,"Amara (excluding her knees and lower legs) standing against a white background, ",236135Amara (excluding her knees and lower legs) standing against a white backgr
amara_full_body_0004.txt,changed,"Amara is kneeling on the ground, set against a white background. Both her hands ","236135Amara is kneeling on the ground, set against a white background. Both her "
amara_full_body_0009.txt,changed,"Amara (excluding her lower legs) is standing outdoors, with some wooden logs and","236135Amara (excluding her lower legs) is standing outdoors, with some wooden lo"
amara_full_body_0012.txt,changed,Amara is kneeling down on a white posidum in the middle of what looks to be an a,236135Amara is kneeling down on a white posidum in the middle of what looks to b
amara_full_body_0013.txt,changed,Amara is standing in the middle of a street (her knees and lower legs not visibl,236135Amara is standing in the middle of a street (her knees and lower legs not 
amara_full_body_0014.txt,changed,Amara is standing in the middle of a street in a city (her knees and lower legs ,236135Amara is standing in the middle of a street in a city (her knees and lower
amara_full_body_0016.txt,changed,"Amara is sitting on a stone bench (lower legs not visible), her body leaning to ","236135Amara is sitting on a stone bench (lower legs not visible), her body leani"
amara_full_body_0017.txt,changed,"Amara is on a fashion, her right hand on her waist and her left arm dangling bes","236135Amara is on a fashion, her right hand on her waist and her left arm dangli"
amara_full_body_0018.txt,changed,"Amara is standing on a rooftop, her right hand on her right-side waist. She is l","236135Amara is standing on a rooftop, her right hand on her right-side waist. Sh"
amara_full_body_0020.txt,changed,Amara on a rooftop - She loves rooftops! Amara's hands are playing with her hair,236135Amara on a rooftop - She loves rooftops! Amara's hands are playing with he
amara_full_body_0021.txt,changed,"Amara kneeling on a bed, her face tilted and turned slightly to her right. Amara","236135Amara kneeling on a bed, her face tilted and turned slightly to her right."
amara_full_body_0024.txt,changed,"Amara posing in the street, her left arm tucked nicely behind her left breast. A","236135Amara posing in the street, her left arm tucked nicely behind her left bre"
amara_full_body_0025.txt,changed,"Amara standing alone on a beach, her face tilted and turned slightly to her righ","236135Amara standing alone on a beach, her face tilted and turned slightly to he"
amara_full_body_0026.txt,changed,"Amara sitting cross-legged on the beach, her face turned slightly to her left si","236135Amara sitting cross-legged on the beach, her face turned slightly to her l"
amara_full_body_0028.txt,changed,"Amara in a single-piece / one-piece red swimsuit, her large breasts bulging the ","236135Amara in a single-piece / one-piece red swimsuit, her large breasts bulgin"
amara_full_body_0029.txt,changed,Amara wearing a mid-length pink nightie / dress (her knees and lower legs exclud,236135Amara wearing a mid-length pink nightie / dress (her knees and lower legs 
amara_full_body_0030.txt,changed,Amara in bondage rope (her lower thighs and lower legs excluded from the picture,236135Amara in bondage rope (her lower thighs and lower legs excluded from the p
amara_full_body_0031.txt,changed,Amara - Full-frontal view: Amara is standing in front of a white background. Thi,236135Amara - Full-frontal view: Amara is standing in front of a white backgroun
amara_full_body_0033.txt,changed,Amara's front-view: Amara smiling. Her body is default - This is how her body lo,236135Amara's front-view: Amara smiling. Her body is default - This is how her b
amara_full_body_0034.txt,changed,"Amara's left-front body: She has a sultry expression, and has a bedsheet draped ","236135Amara's left-front body: She has a sultry expression, and has a bedsheet d"
amara_full_body_0035.txt,changed,"Amara's upper body and face: She is smiling a little, and is wearing a black tan","236135Amara's upper body and face: She is smiling a little, and is wearing a bla"
amara_full_body_0037.txt,changed,Amara kneeling: Her expression is sultry. She is wearing a one-piece lingerie se,236135Amara kneeling: Her expression is sultry. She is wearing a one-piece linge
amara_full_body_0038.txt,changed,Amara kneeling on the bed. Her expression is sultry. Her body is default. Her va,236135Amara kneeling on the bed. Her expression is sultry. Her body is default. 
amara_full_body_0039.txt,changed,"Amara standing outdoors, smiling. Her body is default. Her vagina is almost clea","236135Amara standing outdoors, smiling. Her body is default. Her vagina is almos"
amara_full_body_0040.txt,changed,"Amara outdoors. She is wearing a dark blue jeans, and a pop-out bra made of jute","236135Amara outdoors. She is wearing a dark blue jeans, and a pop-out bra made o"
amara_full_body_0041.txt,changed,Amara standing outdoors. Her expression is mild sultry. This is her perfect defa,236135Amara standing outdoors. Her expression is mild sultry. This is her perfec
amara_full_body_0044.txt,changed,Amara with a very slight smirk. This is her default body: Gorgeous!,236135Amara with a very slight smirk. This is her default body: Gorgeous!
amara_full_body_0045.txt,changed,"Amara standing outdoors in the parking lot. Her expression is a mild, subtle smi","236135Amara standing outdoors in the parking lot. Her expression is a mild, subt"
amara_full_body_0046.txt,changed,Amara standing outdoors. A thin patterned cloth is draped over her shoulders.,236135Amara standing outdoors. A thin patterned cloth is draped over her shoulde
amara_full_body_0047.txt,changed,Amara: View from overhead high-angle.,236135Amara: View from overhead high-angle.
amara_full_body_0048.txt,changed,Amara standing outdoors. Her expression is a very slight smirk.,236135Amara standing outdoors. Her expression is a very slight smirk.
amara_full_body_0049.txt,changed,Amara sitting on a bench in a balcony. Her breasts are looking almost perfect. S,236135Amara sitting on a bench in a balcony. Her breasts are looking almost perf
amara_full_body_0050.txt,changed,"Amara on the deck of a ship, her hand on the railing. This is Amara's default bo","236135Amara on the deck of a ship, her hand on the railing. This is Amara's defa"
amara_full_body_0051.txt,changed,"Amara kneeling on a bed, her expression neutral, one hand on her left thigh - su","236135Amara kneeling on a bed, her expression neutral, one hand on her left thig"
amara_full_body_0052.txt,changed,Amara standing on a balcony overlooking the bay-area - Low-angle view. She has a,236135Amara standing on a balcony overlooking the bay-area - Low-angle view. She
amara_full_body_0053.txt,changed,Amara standing on a balcony overlooking the bay-area - Low-angle view. She has a,236135Amara standing on a balcony overlooking the bay-area - Low-angle view. She
amara_full_body_0054.txt,changed,"Amara kneedling on the floor - Low-angle view, a white semi-sheer garment draped","236135Amara kneedling on the floor - Low-angle view, a white semi-sheer garment "
amara_full_body_0056.txt,changed,"Amara standing outdoors, by the sea. Her expression a very slight smile.","236135Amara standing outdoors, by the sea. Her expression a very slight smile."
amara_full_body_0057.txt,changed,Amara making a pose while standing on a stone ledge. Her expression mildly amusi,236135Amara making a pose while standing on a stone ledge. Her expression mildly
amara_full_body_0058.txt,changed,"Amara sitting cross-legged on the bed, her expression mildly sultry.","236135Amara sitting cross-legged on the bed, her expression mildly sultry."
amara_full_body_0060.txt,changed,"Amara standing in the street, her left arm tucked behind her left breast.","236135Amara standing in the street, her left arm tucked behind her left breast."
amara_full_body_0061.txt,changed,Amara standing outdoors: View of her left-side. Amara's breasts looking good and,236135Amara standing outdoors: View of her left-side. Amara's breasts looking go
amara_full_body_0062.txt,changed,Amara with a very slight smirk. This is her default body: Gorgeous!,236135Amara with a very slight smirk. This is her default body: Gorgeous!
amara_full_body_0063.txt,changed,Amara kneeling in the wild. She is wearing a silver strap around her stomach.,236135Amara kneeling in the wild. She is wearing a silver strap around her stoma
amara_full_body_0064.txt,changed,Amara smiling lightly while outdoors.,236135Amara smiling lightly while outdoors.
amara_full_body_0065.txt,changed,Amara posing in the doorway with a slightly sultry expression. Her body looks pe,236135Amara posing in the doorway with a slightly sultry expression. Her body lo
amara_full_body_0066.txt,changed,"Amara wearing a hat and heels, and standing in a museum.","236135Amara wearing a hat and heels, and standing in a museum."
amara_full_body_0067.txt,changed,"Amara standing in the street: She is wearing a pop-out bra made of jute, and lig","236135Amara standing in the street: She is wearing a pop-out bra made of jute, a"
amara_full_body_0068.txt,changed,Amara in the hills. Her vagina is lightly hairy.,236135Amara in the hills. Her vagina is lightly hairy.
amara_full_body_0069.txt,changed,"Amara standing in the street, her expression a very gentle smile.","236135Amara standing in the street, her expression a very gentle smile."
amara_full_body_0070.txt,changed,"Amara standing in the street, her hands holding something: View of her left-fron","236135Amara standing in the street, her hands holding something: View of her lef"
amara_full_body_0072.txt,changed,Amara outdoors. She is looking down and playing with a string between her hands.,236135Amara outdoors. She is looking down and playing with a string between her 
amara_full_body_0073.txt,changed,Amara looking worried and angry. She is wearing a hat and riding a bicycle on th,236135Amara looking worried and angry. She is wearing a hat and riding a bicycle
amara_full_body_0074.txt,changed,"Amara with her bad-bitch expression, wearing a zebra top outdoors.","236135Amara with her bad-bitch expression, wearing a zebra top outdoors."
amara_full_body_0075.txt,changed,"Amara on the bed, wearing a pink night dress. Her expression is a light subtle s","236135Amara on the bed, wearing a pink night dress. Her expression is a light su"
amara_full_body_0077.txt,changed,"Amara sitting cross-legged on the beach, looking down and with her face turned t","236135Amara sitting cross-legged on the beach, looking down and with her face tu"
amara_full_body_0078.txt,changed,Amara standing on a rooftop. This is a picture of young Amara - from a few years,236135Amara standing on a rooftop. This is a picture of young Amara - from a few
amara_full_body_0079.txt,changed,Amara standing on a ship deck: View of her left-front body. She has a sultry exp,236135Amara standing on a ship deck: View of her left-front body. She has a sult
amara_full_body_0081.txt,changed,"Amara standing in the street. Her head is tilted to her right side, and she is l","236135Amara standing in the street. Her head is tilted to her right side, and sh"
amara_full_body_0082.txt,changed,"Amara: Default body. She is looking gorgeous - Large breasts, wide hips, subtle ","236135Amara: Default body. She is looking gorgeous - Large breasts, wide hips, s"
amara_full_body_0083.txt,changed,"Amara: Default body. She is looking gorgeous - Large breasts, wide hips, subtle ","236135Amara: Default body. She is looking gorgeous - Large breasts, wide hips, s"
amara_full_body_0085.txt,changed,"Amara: Full-body shot. She has a warm, flirtatious, inviting smile.","236135Amara: Full-body shot. She has a warm, flirtatious, inviting smile."
amara_full_body_0086.txt,changed,Amara: Full-body shot. She is looking slightly down at the camera with a neutral,236135Amara: Full-body shot. She is looking slightly down at the camera with a n
amara_full_body_0087.txt,changed,"Amara: Full-body shot. She is looking confident, warm and very sexy.","236135Amara: Full-body shot. She is looking confident, warm and very sexy."
amara_headshot_0009.txt,changed,"Amara with a homely expression, a slight smile. She is looking directly into the","236135Amara with a homely expression, a slight smile. She is looking directly in"
amara_headshot_0010.txt,changed,Amara with a slight smile. She is looking at the camera. Her head is partially t,236135Amara with a slight smile. She is looking at the camera. Her head is parti
amara_headshot_0011.txt,changed,Amara with a bad-bitch expression. Her head is tilted very slightly to her right,236135Amara with a bad-bitch expression. Her head is tilted very slightly to her
amara_headshot_0014.txt,changed,"Amara with a slight, cute smile. Her head is tilted and turned a little to her r","236135Amara with a slight, cute smile. Her head is tilted and turned a little to"
amara_headshot_0015.txt,changed,"Amara with a neutral but slightly sultry expression, her head tilted to her righ","236135Amara with a neutral but slightly sultry expression, her head tilted to he"
amara_headshot_0020.txt,changed,"Amara looking at the camera with a very, very subtle smile. Her face is tilted a","236135Amara looking at the camera with a very, very subtle smile. Her face is ti"
amara_headshot_0021.txt,changed,Amara with a slightly sultry and smiling expression. Her face is tilted to her r,236135Amara with a slightly sultry and smiling expression. Her face is tilted to
amara_headshot_0022.txt,changed,Amara with a subtle smirk on her face. Her face is tilted and turned slightly to,236135Amara with a subtle smirk on her face. Her face is tilted and turned sligh
amara_headshot_0024.txt,changed,Amara turning back with a slightly wide-eyed expression.,236135Amara turning back with a slightly wide-eyed expression.
amara_headshot_0027.txt,changed,Amara with a no-fucks-given expression. Her face is turned a little to her right,236135Amara with a no-fucks-given expression. Her face is turned a little to her
amara_headshot_0028.txt,changed,Amara with a subtle flirtacious smile. Her face is tilted and turned a little to,236135Amara with a subtle flirtacious smile. Her face is tilted and turned a lit
amara_headshot_0029.txt,changed,Amara with a neutral expression.,236135Amara with a neutral expression.
amara_headshot_0032.txt,changed,Amara with a slight smile and a slight smirk. Her head is tilted very slightly t,236135Amara with a slight smile and a slight smirk. Her head is tilted very slig
amara_headshot_0033.txt,changed,Amara with a slight cute smile. Her head is tilted very lightly to her right.,236135Amara with a slight cute smile. Her head is tilted very lightly to her rig
amara_headshot_0035.txt,changed,Amara with a sultry expression. Her head is tilted a little to her right.,236135Amara with a sultry expression. Her head is tilted a little to her right.
amara_headshot_0036.txt,changed,Amara with a slight smirk. Her head is tilted a little to her right side.,236135Amara with a slight smirk. Her head is tilted a little to her right side.
amara_headshot_0037.txt,changed,Amara with a smartass smile. Her face is turned to her right side.,236135Amara with a smartass smile. Her face is turned to her right side.
amara_headshot_0038.txt,changed,Amara with a cute and naughty smile. Her face is tilted to her right side.,236135Amara with a cute and naughty smile. Her face is tilted to her right side.
amara_headshot_0039.txt,changed,Amara with a very subtle sultry expression. Her head is tilted very slightly to ,236135Amara with a very subtle sultry expression. Her head is tilted very slight
amara_headshot_0040.txt,changed,Amara with a slight sultry expression. Her face is turned a little to her right ,236135Amara with a slight sultry expression. Her face is turned a little to her 
amara_headshot_0041.txt,changed,Amara with a slight slutty look. Her face is tilted and turned very little to he,236135Amara with a slight slutty look. Her face is tilted and turned very little
amara_headshot_0043.txt,changed,Amara with a very subtle smile and a very subtle smirk. Her head is tilted and t,236135Amara with a very subtle smile and a very subtle smirk. Her head is tilted
amara_headshot_0044.txt,changed,Amara with a homely look. Her head is tilted to her right side.,236135Amara with a homely look. Her head is tilted to her right side.
amara_headshot_0045.txt,changed,Amara with a neutral expression. Her head is tilted slightly to her right side.,236135Amara with a neutral expression. Her head is tilted slightly to her right 
amara_headshot_0048.txt,changed,Amara with a neutral expression. Her face is tilted and turned very slightly to ,236135Amara with a neutral expression. Her face is tilted and turned very slight
amara_headshot_0049.txt,changed,Amara with a very subtle smirk. Her face is upright and looking straight at the ,236135Amara with a very subtle smirk. Her face is upright and looking straight a
amara_headshot_0050.txt,changed,Amara with a slightly loving look. Her head is tilted very slightly to her right,236135Amara with a slightly loving look. Her head is tilted very slightly to her
amara_headshot_0051.txt,changed,Amara with a very subtle smirk. Her face is tilted very slightly to her right si,236135Amara with a very subtle smirk. Her face is tilted very slightly to her ri
amara_headshot_0052.txt,changed,Amara with a neutral expression. Her face is tilted and turned very slightly to ,236135Amara with a neutral expression. Her face is tilted and turned very slight
amara_headshot_0053.txt,changed,"Amara with a wide-eyed neutral expression. Her face is tilted very, very slightl","236135Amara with a wide-eyed neutral expression. Her face is tilted very, very s"
amara_headshot_0055.txt,changed,Amara with a very subtle smirk. Her face is tilted and turned very slightly to h,236135Amara with a very subtle smirk. Her face is tilted and turned very slightl
amara_headshot_0056.txt,changed,Amara with a very subtle smirk. Her face is tilted and turned very slightly to h,236135Amara with a very subtle smirk. Her face is tilted and turned very slightl
amara_headshot_0057.txt,changed,Amara with a neutral expression. Her face is slightly turned to her right.,236135Amara with a neutral expression. Her face is slightly turned to her right.
amara_headshot_0058.txt,changed,Amara turning back to look at the camera with a slightly sultry expression.,236135Amara turning back to look at the camera with a slightly sultry expression
amara_headshot_0060.txt,changed,Amara with a slight smile. Her head is tilted slightly to her right side.,236135Amara with a slight smile. Her head is tilted slightly to her right side.
amara_headshot_0062.txt,changed,Amara with a very subtle sultry expression. Her head is tilted very slightly to ,236135Amara with a very subtle sultry expression. Her head is tilted very slight
amara_headshot_0064.txt,changed,Amara with an almost neutral expression. Her face is tilted and turned slightly ,236135Amara with an almost neutral expression. Her face is tilted and turned sli
amara_headshot_0066.txt,changed,Amara with a very subtle smile. Her face is tilted very slightly to her right si,236135Amara with a very subtle smile. Her face is tilted very slightly to her ri
amara_headshot_0068.txt,changed,Amara with a shocked and afraid expresion. Her face is turned towards her right.,236135Amara with a shocked and afraid expresion. Her face is turned towards her 
amara_headshot_0069.txt,changed,"Amara with a smile. She is looking down. Her face is turned slightly downwards, ",236135Amara with a smile. She is looking down. Her face is turned slightly downw
amara_headshot_0070.txt,changed,Amara with a very subtle sultry expression. Her head is tilted slightly to her r,236135Amara with a very subtle sultry expression. Her head is tilted slightly to
amara_headshot_0071.txt,changed,Amara with a slightly sultry but largely neutral expression. Her head is tilted ,236135Amara with a slightly sultry but largely neutral expression. Her head is t
amara_headshot_0072.txt,changed,"Amara with a slight endearing smile. Her face is lifted very slightly upwards, a",236135Amara with a slight endearing smile. Her face is lifted very slightly upwa
amara_headshot_0073.txt,changed,"Amara with a very slight sultry, but largely neutral expression. Her face is eve","236135Amara with a very slight sultry, but largely neutral expression. Her face "
amara_headshot_0074.txt,changed,Amara with a slight cute and homely smile. Her head is tilted and turned very sl,236135Amara with a slight cute and homely smile. Her head is tilted and turned v
amara_headshot_0077.txt,changed,"Amara with a very slight smile, but largely helpless expression. Her head is ver","236135Amara with a very slight smile, but largely helpless expression. Her head "
amara_headshot_0079.txt,changed,"Amara with a very subtle smile. Her face is turned very slightly downwards, and ",236135Amara with a very subtle smile. Her face is turned very slightly downwards
amara_headshot_0080.txt,changed,"Amara with a neutral, bored expression. Her face is tilted and turned slightly t","236135Amara with a neutral, bored expression. Her face is tilted and turned slig"
amara_headshot_0081.txt,changed,"Amara with a small smile, her head tilted very slightly to her right side.","236135Amara with a small smile, her head tilted very slightly to her right side."
amara_headshot_0082.txt,changed,"Amara with an upright face, and a very faint smile.","236135Amara with an upright face, and a very faint smile."
amara_headshot_0084.txt,changed,Amara with cute but naughty smile. Her head is tilted and turned slightly to her,236135Amara with cute but naughty smile. Her head is tilted and turned slightly 
amara_headshot_0085.txt,changed,Amara with a bad-bitch expression. Her face is turned very slightly to her right,236135Amara with a bad-bitch expression. Her face is turned very slightly to her
amara_headshot_0089.txt,changed,"Amara with a neutral expression, looking into the distance. Her face is turned t","236135Amara with a neutral expression, looking into the distance. Her face is tu"
amara_headshot_0091.txt,changed,"Amara with a subtle smile, her face turned to her left side.","236135Amara with a subtle smile, her face turned to her left side."
amara_headshot_0094.txt,changed,Amara with a smile. Her head is titled very slightly to her right.,236135Amara with a smile. Her head is titled very slightly to her right.
amara_headshot_0097.txt,changed,"Amara about to take a bite, her expression very slightly amazed.","236135Amara about to take a bite, her expression very slightly amazed."
amara_headshot_0099.txt,changed,"Amara with a sultry expression. Her head is tilted slightly backwards, and her f","236135Amara with a sultry expression. Her head is tilted slightly backwards, and"
amara_headshot_0101.txt,changed,Amara with a slightly sultry look. Her face is very slightly turned and tilted t,236135Amara with a slightly sultry look. Her face is very slightly turned and ti
amara_headshot_0102.txt,changed,"Amara with a very slight sultry expression. Her head is tilted and turned very, ",236135Amara with a very slight sultry expression. Her head is tilted and turned 
amara_headshot_0103.txt,changed,"Amara with a very subtle sultry expression. Her head is tilted and turned very, ",236135Amara with a very subtle sultry expression. Her head is tilted and turned 
amara_headshot_0106.txt,changed,Amara with a cute and subtle smile. Her face is tilted very slightly to her righ,236135Amara with a cute and subtle smile. Her face is tilted very slightly to he
amara_headshot_0109.txt,changed,Amara with a slightly angry expression. Her face is looking almost straight.,236135Amara with a slightly angry expression. Her face is looking almost straigh
amara_headshot_0111.txt,changed,Amara with a determined look. Her face is turned to her right.,236135Amara with a determined look. Her face is turned to her right.
amara_headshot_0113.txt,changed,Amara with a small smile. Hre face is very slightly tilted and turned to her rig,236135Amara with a small smile. Hre face is very slightly tilted and turned to h
amara_headshot_0114.txt,changed,Amara with a neutral expression. Her face is turned a little to her right.,236135Amara with a neutral expression. Her face is turned a little to her right.
amara_headshot_0116.txt,changed,Amara with a sultry expression. Her head is tilted to her right. She is looking ,236135Amara with a sultry expression. Her head is tilted to her right. She is lo
amara_headshot_0117.txt,changed,Amara with a very subtle smirk on her face. Her head is tilted and turned very s,236135Amara with a very subtle smirk on her face. Her head is tilted and turned 
amara_headshot_0118.txt,changed,Amara: Headshot. She has a fiery look in her eyes.,236135Amara: Headshot. She has a fiery look in her eyes.
amara_headshot_0119.txt,changed,"Amara: Headshot. She has a cute, homely smile.","236135Amara: Headshot. She has a cute, homely smile."
amara_headshot_0120.txt,changed,"Amara: Headshot. She has a warm, homely smile.","236135Amara: Headshot. She has a warm, homely smile."
amara_headshot_0121.txt,changed,Amara: Headshot. She has a neutral but determined expression.,236135Amara: Headshot. She has a neutral but determined expression.
amara_headshot_0122.txt,changed,Amara: Headshot. She has a neutral expression.,236135Amara: Headshot. She has a neutral expression.
