relative_path,action,old_head,new_head
amara_headshot_0123.txt,changed,Amara: Headshot. She has a neutral expression.,236135Amara: Headshot. She has a neutral expression.
amara_headshot_0124.txt,changed,Amara: Headshot. She has a neutral expression.,236135Amara: Headshot. She has a neutral expression.
amara_headshot_0125.txt,changed,Amara: Headshot. She is crying and has a hurt expression.,236135Amara: Headshot. She is crying and has a hurt expression.
amara_headshot_0126.txt,changed,Amara: Headshot. She has a confident and suave expression.,236135Amara: Headshot. She has a confident and suave expression.
amara_headshot_0127.txt,changed,Amara: Headshot. She has a subtle warm smile.,236135Amara: Headshot. She has a subtle warm smile.
amara_headshot_0128.txt,changed,Amara: Headshot. Her eyes are looking to her left. She has a slightly naughty ex,236135Amara: Headshot. Her eyes are looking to her left. She has a slightly naug
amara_headshot_0129.txt,changed,"Amara: Headshot. She has a feisty expression. Amara's eyes are looking upwards, ",236135Amara: Headshot. She has a feisty expression. Amara's eyes are looking upw
amara_headshot_0130.txt,changed,Amara: Headshot. She has a neutral expression.,236135Amara: Headshot. She has a neutral expression.
amara_headshot_0132.txt,changed,Amara: Headshot. She has a neutral expression.,236135Amara: Headshot. She has a neutral expression.
amara_medium_body_0001.txt,changed,Amara with a slight smile. Her face turned slightly upwards and to her right.,236135Amara with a slight smile. Her face turned slightly upwards and to her rig
amara_medium_body_0002.txt,changed,Amara in a shallow water body. Her face turned slightly upwards and to her right,236135Amara in a shallow water body. Her face turned slightly upwards and to her
amara_medium_body_0003.txt,changed,"Amara with a small smile, wearing a white body-fitting white dress. She is stand","236135Amara with a small smile, wearing a white body-fitting white dress. She is"
amara_medium_body_0004.txt,changed,"Amara with a small smile, wearing white body-fitting clothes.","236135Amara with a small smile, wearing white body-fitting clothes."
amara_medium_body_0005.txt,changed,"Amara sitting in the desert, wearing colorful blue shorts. She has a neutral exp","236135Amara sitting in the desert, wearing colorful blue shorts. She has a neutr"
amara_medium_body_0006.txt,changed,"Amara with a very subtle smile, holding a off-white scarf with brown patches beh","236135Amara with a very subtle smile, holding a off-white scarf with brown patch"
amara_medium_body_0007.txt,changed,"Amara standing on a low-rooftop, with a sheer chiffon cloth draped over her head","236135Amara standing on a low-rooftop, with a sheer chiffon cloth draped over he"
amara_medium_body_0009.txt,changed,"Amara turning back to look at the camera, her right hand crossing in fron of her","236135Amara turning back to look at the camera, her right hand crossing in fron "
amara_medium_body_0010.txt,changed,"Amara with a very determined expression on her face, her head turned to her righ","236135Amara with a very determined expression on her face, her head turned to he"
amara_medium_body_0011.txt,changed,"Amara standing in the middle of the street, her expression a subtle smile, her f","236135Amara standing in the middle of the street, her expression a subtle smile,"
amara_medium_body_0012.txt,changed,"Amara standing in the middle of the street, her expression a very subtle smile, ","236135Amara standing in the middle of the street, her expression a very subtle s"
amara_medium_body_0013.txt,changed,"Amara in the middle of taking a bite of food, her expression very slightly shock","236135Amara in the middle of taking a bite of food, her expression very slightly"
amara_medium_body_0014.txt,changed,Amara: Medium-body shot. She is looking with a neutral expression.,236135Amara: Medium-body shot. She is looking with a neutral expression.
amara_medium_body_0015.txt,changed,"Amara: Medium-body shot. She is turning back to look at the camera with a warm, ",236135Amara: Medium-body shot. She is turning back to look at the camera with a 
amara_medium_body_0016.txt,changed,Amara: Medium-body shot. She is standing in a swimming pool and crying. Her eyes,236135Amara: Medium-body shot. She is standing in a swimming pool and crying. He
amara_medium_body_0017.txt,changed,Amara: Medium-body shot. She has a confident and naughty expression.,236135Amara: Medium-body shot. She has a confident and naughty expression.
amara_medium_body_0018.txt,changed,"Amara: Medium-body shot. Amara has a calm expression, and is looking down, a lit","236135Amara: Medium-body shot. Amara has a calm expression, and is looking down,"
amara_medium_body_0019.txt,changed,Amara: Medium-body shot. She is looking at the camera with a soft but confident ,236135Amara: Medium-body shot. She is looking at the camera with a soft but conf
amara_medium_body_0020.txt,changed,Amara: Medium-body shot. She has a confident and slightly intelligent expression,236135Amara: Medium-body shot. She has a confident and slightly intelligent expr
